[
  {
    "schema_version": "1.0.0",
    "keyword_id": "00000000-0000-4000-8000-000000000050",
    "project_id": "00000000-0000-4000-8000-000000000001",
    "locale_id": "00000000-0000-4000-8000-000000000010",
    "market_id": "00000000-0000-4000-8000-000000000020",
    "content_target_id": "00000000-0000-4000-8000-000000000031",
    "source_batch_id": "00000000-0000-4000-8000-000000000040",
    "source_row_number": 2,
    "original_phrase": "  Автоматизация БИЗНЕС-процессов  ",
    "normalized_phrase": "автоматизация бизнес процессов",
    "locale_tag": "ru-UA",
    "normalizer": {"name": "deterministic_text", "version": "1.0.0", "rules": ["unicode_nfkc", "casefold", "punctuation_to_space", "collapse_whitespace", "trim_whitespace"]},
    "metrics": null,
    "provenance_class": "normalized",
    "source": {"source_type": "derived", "actor_ref": "system:normalizer", "recorded_at": "2026-09-25T12:10:00+03:00", "parent_artifact_ids": ["00000000-0000-4000-8000-000000000040"]},
    "validation": {"valid": true, "validator": "r0_contract_fixture", "validator_version": "1.0.0", "checked_at": "2026-09-25T12:10:01+03:00", "error_count": 0, "warning_count": 0, "issues": []}
  },
  {
    "schema_version": "1.0.0",
    "keyword_id": "00000000-0000-4000-8000-000000000051",
    "project_id": "00000000-0000-4000-8000-000000000001",
    "locale_id": "00000000-0000-4000-8000-000000000010",
    "market_id": "00000000-0000-4000-8000-000000000020",
    "content_target_id": "00000000-0000-4000-8000-000000000031",
    "source_batch_id": "00000000-0000-4000-8000-000000000040",
    "source_row_number": 3,
    "original_phrase": "CRM для отдела продаж",
    "normalized_phrase": "crm для отдела продаж",
    "locale_tag": "ru-UA",
    "normalizer": {"name": "deterministic_text", "version": "1.0.0", "rules": ["unicode_nfkc", "casefold", "punctuation_to_space", "collapse_whitespace", "trim_whitespace"]},
    "metrics": null,
    "provenance_class": "normalized",
    "source": {"source_type": "derived", "actor_ref": "system:normalizer", "recorded_at": "2026-09-25T12:10:00+03:00", "parent_artifact_ids": ["00000000-0000-4000-8000-000000000040"]},
    "validation": {"valid": true, "validator": "r0_contract_fixture", "validator_version": "1.0.0", "checked_at": "2026-09-25T12:10:01+03:00", "error_count": 0, "warning_count": 0, "issues": []}
  },
  {
    "schema_version": "1.0.0",
    "keyword_id": "00000000-0000-4000-8000-000000000052",
    "project_id": "00000000-0000-4000-8000-000000000001",
    "locale_id": "00000000-0000-4000-8000-000000000010",
    "market_id": "00000000-0000-4000-8000-000000000020",
    "content_target_id": "00000000-0000-4000-8000-000000000031",
    "source_batch_id": "00000000-0000-4000-8000-000000000040",
    "source_row_number": 4,
    "original_phrase": "внедрение crm украина",
    "normalized_phrase": "внедрение crm украина",
    "locale_tag": "ru-UA",
    "normalizer": {"name": "deterministic_text", "version": "1.0.0", "rules": ["unicode_nfkc", "casefold", "punctuation_to_space", "collapse_whitespace", "trim_whitespace"]},
    "metrics": null,
    "provenance_class": "normalized",
    "source": {"source_type": "derived", "actor_ref": "system:normalizer", "recorded_at": "2026-09-25T12:10:00+03:00", "parent_artifact_ids": ["00000000-0000-4000-8000-000000000040"]},
    "validation": {"valid": true, "validator": "r0_contract_fixture", "validator_version": "1.0.0", "checked_at": "2026-09-25T12:10:01+03:00", "error_count": 0, "warning_count": 0, "issues": []}
  },
  {
    "schema_version": "1.0.0",
    "keyword_id": "00000000-0000-4000-8000-000000000053",
    "project_id": "00000000-0000-4000-8000-000000000001",
    "locale_id": "00000000-0000-4000-8000-000000000011",
    "market_id": "00000000-0000-4000-8000-000000000022",
    "content_target_id": "00000000-0000-4000-8000-000000000032",
    "source_batch_id": "00000000-0000-4000-8000-000000000041",
    "source_row_number": 2,
    "original_phrase": "Автоматизація бізнес-процесів",
    "normalized_phrase": "автоматизація бізнес процесів",
    "locale_tag": "uk-UA",
    "normalizer": {"name": "deterministic_text", "version": "1.0.0", "rules": ["unicode_nfkc", "casefold", "punctuation_to_space", "collapse_whitespace", "trim_whitespace"]},
    "metrics": null,
    "provenance_class": "normalized",
    "source": {"source_type": "derived", "actor_ref": "system:normalizer", "recorded_at": "2026-09-25T12:11:00+03:00", "parent_artifact_ids": ["00000000-0000-4000-8000-000000000041"]},
    "validation": {"valid": true, "validator": "r0_contract_fixture", "validator_version": "1.0.0", "checked_at": "2026-09-25T12:11:01+03:00", "error_count": 0, "warning_count": 0, "issues": []}
  },
  {
    "schema_version": "1.0.0",
    "keyword_id": "00000000-0000-4000-8000-000000000054",
    "project_id": "00000000-0000-4000-8000-000000000001",
    "locale_id": "00000000-0000-4000-8000-000000000011",
    "market_id": "00000000-0000-4000-8000-000000000022",
    "content_target_id": "00000000-0000-4000-8000-000000000032",
    "source_batch_id": "00000000-0000-4000-8000-000000000041",
    "source_row_number": 3,
    "original_phrase": "CRM для відділу продажів",
    "normalized_phrase": "crm для відділу продажів",
    "locale_tag": "uk-UA",
    "normalizer": {"name": "deterministic_text", "version": "1.0.0", "rules": ["unicode_nfkc", "casefold", "punctuation_to_space", "collapse_whitespace", "trim_whitespace"]},
    "metrics": null,
    "provenance_class": "normalized",
    "source": {"source_type": "derived", "actor_ref": "system:normalizer", "recorded_at": "2026-09-25T12:11:00+03:00", "parent_artifact_ids": ["00000000-0000-4000-8000-000000000041"]},
    "validation": {"valid": true, "validator": "r0_contract_fixture", "validator_version": "1.0.0", "checked_at": "2026-09-25T12:11:01+03:00", "error_count": 0, "warning_count": 0, "issues": []}
  },
  {
    "schema_version": "1.0.0",
    "keyword_id": "00000000-0000-4000-8000-000000000055",
    "project_id": "00000000-0000-4000-8000-000000000001",
    "locale_id": "00000000-0000-4000-8000-000000000011",
    "market_id": "00000000-0000-4000-8000-000000000022",
    "content_target_id": "00000000-0000-4000-8000-000000000032",
    "source_batch_id": "00000000-0000-4000-8000-000000000041",
    "source_row_number": 4,
    "original_phrase": "впровадження crm в україні",
    "normalized_phrase": "впровадження crm в україні",
    "locale_tag": "uk-UA",
    "normalizer": {"name": "deterministic_text", "version": "1.0.0", "rules": ["unicode_nfkc", "casefold", "punctuation_to_space", "collapse_whitespace", "trim_whitespace"]},
    "metrics": null,
    "provenance_class": "normalized",
    "source": {"source_type": "derived", "actor_ref": "system:normalizer", "recorded_at": "2026-09-25T12:11:00+03:00", "parent_artifact_ids": ["00000000-0000-4000-8000-000000000041"]},
    "validation": {"valid": true, "validator": "r0_contract_fixture", "validator_version": "1.0.0", "checked_at": "2026-09-25T12:11:01+03:00", "error_count": 0, "warning_count": 0, "issues": []}
  }
]
